"Serial_Number", "User_ID", "Main_Content", "Time", "Max_Word_Indicator"
"Boy-Girl#M.1545762690.A.B88#00000", "cipher2372", "12/30更新<br>謝謝大家指教<br><br>經過幾天深刻反省<br>是我太自私了<br>只覺得反正自己沒有要出軌<br>也自以爲只要知道自己在做什麼就好了<br>就自顧自的做想做的事<br><br>一直都是以自己的想法跟感受為主<br>卻沒顧慮到妳的感受<br>妳要的安全感其實就希望我能避嫌<br>一直以來都覺得這兩個字只是種行事方法<br>而不了解為什麼要這樣做<br><br>避嫌就是不要覺得自己很厲害總覺得自己什麼事情都可以控制<br>要避免一些自己不可以控制的事情<br><br>一直到這幾天才對這兩個字的真義有深刻的體悟<br>才了解之前做的事所造成的傷害<br>真的很抱歉<br><br><br>------------------------------------------<br><br>大家好 謝謝大家給予的意見跟指教<br>我是原po的男友<br><br>目前在返台的飛機上<br>思緒很亂，使用手機編輯<br>文長 內容排版請再多包涵了<br><br>首先非常感謝我女友願意花錢花時間陪我走這趟旅行<br>知道他怕冷喜歡去熱帶國家<br>但還是想帶他去歐洲過看看耶誕假期<br>所以還是硬把她給坳來了<br>但因為我個人自私的行為毀了這趟旅程<br><br>旅程的第一天女友看到我傳line給女同事<br>女同事傳他微整形的術後傷口照片給我<br>問我是不是有有問題<br>我沒想太多就回了抵達後拍的照片再簡單寒暄幾句就這樣<br>在這邊要先澄清，女同事一定不會只有問我<br>只要在他旁邊的人她都會一直問大家意見<br>決定整之前就這樣了，所以傳照片問我並不是因為我比較特別<br><br>我工作的公司是我親戚長輩開的<br>全公司就6個人<br>是從事業務性質工作<br>親戚也有看過幾次我女友<br>在這種狀況如果真的跟女同事有勾搭<br>我對我親戚也是很難交代<br>在家族名聲會黑掉的意思<br>所以我根本從來沒有過這種想法<br>也只把女同事當成一般朋友<br>辦公室還有兩個年齡相近的男同事<br>除了公事我們也會像朋友一樣聊生活感情事<br>大家在辦公室在line上有時候也會互相亂虧亂鬧一下<br><br>我女友的脾氣比較拗<br>有時候我會有點招架不著<br>偶爾會跟同事或朋友吐吐苦水抒發一下<br>不過就單純抒發而已<br>這些訊息我覺得她不需要看到<br>所以當她第一天要看我手機時<br>我怕她看到這些訊息會掃了出遊的興<br>所以搶回來後索性就都刪除了<br>這也是她堅持要分的一個原因<br><br>出發前幾天女同事跟我line開玩笑<br>不要兩個人去三個人回來<br>我隨便回了句 我都有點怕兩個人出去一個人回來<br>我就是怕她看到這類的訊息，想不到也真的一語成讖<br><br>第一天晚上我女友就跟我提了分手<br>我承認自己的錯誤<br>也承諾未來會往她想要的方式來改<br>但她很堅持要分<br>我知道在氣頭上多說無益<br><br>同時她也提出了那第二天起就分開走<br>我當然不希望這種狀況發生<br>主要的錢在我身上沒錯<br>因為之前幾次我們出去也都是這樣<br>我是大pool他是小pool<br>分散風險的概念<br>但如果她非常的堅持<br>我一定會把所有身上的現金加上一張卡給她<br>也會幫她安排好接下來的交通跟住宿<br>但這是我最不樂見的狀況<br>我還是希望在未來幾天旅程的表現能夠讓女友回心轉意<br><br>第二天起我們的行為就恢復一般朋友狀態<br>往後幾天我還是裝成沒事對他還是一如往常<br>也盡力讓女友這趟旅行能走的順走的舒適<br>雖然還是兩個人一起走<br>但常常感覺個走個的<br>後來她也不讓我幫她拍照<br>我在拍照也會感覺一直要避開我的鏡頭<br>心裡也一直酸酸的<br>這趟難得且原本應該要一起創造更多美好回憶的旅行變成這樣<br>只能說是我自己造成的也不能多說什麼<br>就這樣忐忑到了旅程的最後一晚<br>原本希望這幾天表現能讓她回心轉意<br>12/24吃完晚餐後在餐廳裡<br>她自己先開口提了<br><br>你應該知道就算回台灣我還是不會跟你複合<br><br>我愣住了<br>想不到在平安夜吃完算耶誕大餐後還是得到這個<br><br>挽回還是失敗了<br><br>旅程後來幾天女友對我的反應也讓我以為我還有機會<br>或許是像版友講的因為不想出事才裝出這些反應<br>如果真的是這樣我會有點難過<br>畢竟在一起兩年也曾經一起出去了四趟<br>我想我對你建立的信任是不管在任何狀況下我都不可能做出任何傷害你的事情<br><br>一直到現在感覺都不是很真實<br>我想這會是映像最深刻的一次耶誕節<br>目前沒什麼想法但我還沒放棄<br><br><br>※ 引述《goforaride (紅湯圓)》之銘言：<br>: 報平安的更更新～<br>: 風景很美心情不美，在前任哭著n次求我再給他一次機會之下<br>: 想想我的辛苦錢，就決定繼續一起旅程了<br>: 聊天中得知他們還有接送情，前任回我：<br>: 「她就要我載，我要怎麼拒絕你告訴我」<br>: 喔～～～原來是不好意思拒絕的部分啊！呵呵<br>: 連買伴手禮都有想到女同事，還是一樣在我面前提起呢<br>: 不過我的心情很平靜，就像看戲一樣～<br>: 我回國一定要去檢查眼睛，too sick!<br>: ———————————————————<br>: 來更新囉！<br>: 前任說把對話都刪了一樣不給看手機<br>: 跟我說他會改，要求看手機他反應大<br>: 我說他反應大，他還怪我反應大到上ptt發文，哈<br>: 「我也不怕你知道我有發」<br>: 這趟就當朋友一起出來玩<br>: 已經提分手了～ 不過真正回到台灣才是開始解脫<br>: 謝謝大家，目前是滿平靜的，應該不會有什麼事<br>: ———————————————————<br>: 其實知道一陣子了，男友大概在一個月前都有提到這個女同事<br>: 當時我只想說不過就是一個想整形的女同事<br>: 想整形但一直問男友公司大家的意見，所以才聊天<br>: 沒想到最近變成很常私下在line聊天<br>: 昨天我們一起出國，剛飛了十多個小時的飛機下機<br>: 他們還在聊！聊一整路<br>: 現在人在路程三個多小時的巴士上也在聊<br>: 以前給看對話紀錄，剛剛要拿手機就完全不給碰<br>: 他是很愛跟前女友聯絡，沒想到現在換女同事了    呵呵<br>: 後面還有10天旅程，就我們兩個自由行<br>: 心情該怎麼調適好    X<br>: -----<br>: Sent from JPTT on my iPhone<br><br>-----<br>Sent from JPTT on my iPhone<br><br>--<br>", "", ""
"Boy-Girl#M.1545762690.A.B88#00001", "dragonashco", "家務事自己關門解決啦", "12/26 02:38", "0"
"Boy-Girl#M.1545762690.A.B88#00002", "oouso", "你避重就輕，除了吐苦水跟整形你前女友還講了很多事你要不要解釋一下？聊整路？跟前前女友勾搭？接送情？你其實是上來裝乖懺悔給前女友看的吧。", "12/26 02:46", "1"
"Boy-Girl#M.1545762690.A.B88#00003", "GirlWhoCode", "放了她吧 出國還在她面前一直跟女生聊天 換做是你女友出國時一直跟男生聊天 你可以接受？", "12/26 02:47", "1"
"Boy-Girl#M.1545762690.A.B88#00004", "iLeyaSin365", "才不過跟女同事聊聊LINE就被分手 她也沒多喜歡你，這女友沒什麼好可惜的啦!( 我這也不過是拿女生 會套用在男生的框架來用而已)", "12/26 02:48", "0"
"Boy-Girl#M.1545762690.A.B88#00005", "lalaishiuan", "聊整路很不尊重對方欸，而且你女友說之前私下也是一直line。總覺得你現在才發現事情嚴重了~", "12/26 02:49", "1"
"Boy-Girl#M.1545762690.A.B88#00006", "o1579o", "女友做得好啊!!! 你現在可以好好聊了怎不開心，伴手禮送給女同事了嗎", "12/26 03:25", "0"
"Boy-Girl#M.1545762690.A.B88#00007", "niuiheart", "所以是一直聊還是沒有啊？", "12/26 03:41", "0"
"Boy-Girl#M.1545762690.A.B88#00008", "h5ji6", "問心無愧的話 還會怕人看手機 呵呵", "12/26 03:42", "0"
"Boy-Girl#M.1545762690.A.B88#00009", "asuka00", "可是你現在這個行為就是傷害她了啊！她不可能只有看到你傳訊息一次才發火吧！", "12/26 03:45", "1"
"Boy-Girl#M.1545762690.A.B88#00010", "miconches", "飛機上聊 公車上也聊 還有接送情？會不會太避重就輕了點？整形有這麼好聊喔？", "12/26 04:19", "1"
"Boy-Girl#M.1545762690.A.B88#00011", "Reneeeating", "好可憐喲 怎樣，盡情跟女同事聊天吧", "12/26 04:35", "0"
"Boy-Girl#M.1545762690.A.B88#00012", "kissdodo", "這下子可以盡情聊了", "12/26 04:35", "0"
"Boy-Girl#M.1545762690.A.B88#00013", "Reneeeating", "刪訊息記錄就有鬼吧～", "12/26 04:41", "0"
"Boy-Girl#M.1545762690.A.B88#00014", "Dvallina", "訊息都刪了才講說我傳了XXX怕妳生氣才刪掉，笑死，只有你寫的那些就不會刪了啦~", "12/26 06:59", "0"
"Boy-Girl#M.1545762690.A.B88#00015", "mature000999", "順利分手不就能在家人祝福下跟女同事在一起 很好啊聊好聊滿吧現在曖昧還有難交代哦 科科 騙人沒出過社會", "12/26 07:14", "1"
"Boy-Girl#M.1545762690.A.B88#00016", "PURRMI", "恭喜女方擺脫一個XX", "12/26 07:16", "0"
"Boy-Girl#M.1545762690.A.B88#00017", "DickCowBoy", "清官難斷家務事 你加油吧", "12/26 07:19", "0"
"Boy-Girl#M.1545762690.A.B88#00018", "sck3612575", "分了也好 她只是想找機會分而已 可憐你的錢", "12/26 07:27", "0"
"Boy-Girl#M.1545762690.A.B88#00019", "bq99", "玩這麼久喔", "12/26 07:35", "0"
"Boy-Girl#M.1545762690.A.B88#00020", "michael0419", "分了也好 這種脾氣你也能忍半年，*兩年", "12/26 07:35", "0"
"Boy-Girl#M.1545762690.A.B88#00021", "toyamaka", "買雞排囉", "12/26 07:41", "0"
"Boy-Girl#M.1545762690.A.B88#00022", "jay3u7218", "呵呵", "12/26 07:44", "0"
"Boy-Girl#M.1545762690.A.B88#00023", "joy024", "版友也不知道你刪掉的訊息內容，只能說信任是很難挽回的，而且刪訊息真的很作賊心虛", "12/26 07:44", "1"
"Boy-Girl#M.1545762690.A.B88#00024", "goulina", "聊整路沒幾個能接受的，而且說和女同事怎樣親戚那會黑掉?通常都嘛護自己人哪會黑，少騙人", "12/26 07:49", "1"
"Boy-Girl#M.1545762690.A.B88#00025", "goulina", "你就繼續不知道怎麼拒絕接送吧", "12/26 07:51", "0"
"Boy-Girl#M.1545762690.A.B88#00026", "CozyLife", "換一個就好啦", "12/26 07:58", "0"
"Boy-Girl#M.1545762690.A.B88#00027", "asshole5566", "自己當初不懂避嫌跟珍惜 失去才來哭哭 自找的啦 分了真的對女生比較好！", "12/26 08:06", "1"
"Boy-Girl#M.1545762690.A.B88#00028", "peiyuchen", "恭喜，這下和女同事可以聊到海枯石爛了", "12/26 08:08", "0"
"Boy-Girl#M.1545762690.A.B88#00029", "abby9160", "可以盡情跟女同事聊天、接送，也不用擔心在親戚那邊黑，掉了恭喜哦", "12/26 08:10", "0"
"Boy-Girl#M.1545762690.A.B88#00030", "bestmoe", "真的 親戚怎可能黑這個 以為我沒親戚喔", "12/26 08:10", "0"
"Boy-Girl#M.1545762690.A.B88#00031", "bella0902", "我前任也是這樣 跟女同事聊很爽 精神出軌 所以我看到這種跟女同事line的 我就想噓", "12/26 08:13", "1"
"Boy-Girl#M.1545762690.A.B88#00032", "abccat0520", "這下你可以跟女同事放心聊囉～", "12/26 08:14", "0"
"Boy-Girl#M.1545762690.A.B88#00033", "joinlove1234", "可以整路聊我才不信療整形，還是有聊到要豐胸？", "12/26 08:18", "0"
"Boy-Girl#M.1545762690.A.B88#00034", "vinger92621", "連接送都不會拒絕 分分剛好啦", "12/26 08:19", "0"
"Boy-Girl#M.1545762690.A.B88#00035", "cwjing", "你是不是以為鄉民們很好騙？", "12/26 08:20", "0"
"Boy-Girl#M.1545762690.A.B88#00036", "ersatz", "「印」象", "12/26 08:21", "0"
"Boy-Girl#M.1545762690.A.B88#00037", "libu", "可以放心跟女同事聊個天南地北了", "12/26 08:22", "0"
"Boy-Girl#M.1545762690.A.B88#00038", "gold9450412", "這是反串還是真的男友啊", "12/26 08:23", "0"
"Boy-Girl#M.1545762690.A.B88#00039", "GorgeousRose", "別在這裝可憐 騎驢找馬哥", "12/26 08:24", "0"
"Boy-Girl#M.1545762690.A.B88#00040", "kakotun", "比較想知道你哭了幾次  豪好笑額", "12/26 08:25", "0"
"Boy-Girl#M.1545762690.A.B88#00041", "StayJunkies", "嘻嘻嘻嘻嘻嘻嘻你怎麼愣住了 繼續聊啊 怎麼不繼續聊哈哈哈", "12/26 08:27", "1"
"Boy-Girl#M.1545762690.A.B88#00042", "TKW5566", "？？", "12/26 08:29", "0"
"Boy-Girl#M.1545762690.A.B88#00043", "HeavyBlue", "會怕早就封鎖了", "12/26 08:33", "0"
"Boy-Girl#M.1545762690.A.B88#00044", "abby9160", "以為性別正確哭哭就有用喔", "12/26 08:36", "0"
"Boy-Girl#M.1545762690.A.B88#00045", "submit0104", "反正你也和同事抱怨女友，現在才來溝通太晚了", "12/26 08:38", "0"
"Boy-Girl#M.1545762690.A.B88#00046", "rea1", "要你載就載 女友 要你滾怎麼不滾", "12/26 08:42", "0"
"Boy-Girl#M.1545762690.A.B88#00047", "enock11", "幼稚女不正常", "12/26 08:50", "0"
"Boy-Girl#M.1545762690.A.B88#00048", "koike0703", "哈哈不要臉", "12/26 08:56", "0"
"Boy-Girl#M.1545762690.A.B88#00049", "Ajisai", "看來你還是覺得沒什麼 女同事整形後為什麼要問你？你是整形外科醫生？", "12/26 08:58", "0"
"Boy-Girl#M.1545762690.A.B88#00050", "surreallin", "出去玩還一直跟其他女生聊天 當女友隱形就對了", "12/26 08:59", "0"
"Boy-Girl#M.1545762690.A.B88#00051", "Ajisai", "你已經做出傷害你前女友的事了 你還覺得沒有", "12/26 09:01", "0"
"Boy-Girl#M.1545762690.A.B88#00052", "mistral5140", "先解釋為什麼聊整路吧......重點都不講欸", "12/26 09:02", "0"
"Boy-Girl#M.1545762690.A.B88#00053", "surreallin", "放你女友一條生路吧", "12/26 09:02", "0"
"Boy-Girl#M.1545762690.A.B88#00054", "ting0225", "心裡有鬼才會刪訊息", "12/26 09:02", "0"
"Boy-Girl#M.1545762690.A.B88#00055", "hit0123", "分", "12/26 09:03", "0"
"Boy-Girl#M.1545762690.A.B88#00056", "xxxhiz", "你有些交代的不清不楚，避重就輕的心態呵呵", "12/26 09:05", "0"
"Boy-Girl#M.1545762690.A.B88#00057", "hbfu", "光看你寫的回覆對照女友的作法，只能說恭喜「前」女友做了，正確的決定", "12/26 09:08", "0"
"Boy-Girl#M.1545762690.A.B88#00058", "fatman5566", "藉口一堆欸", "12/26 09:09", "0"
"Boy-Girl#M.1545762690.A.B88#00059", "logitech2004", "裝可憐", "12/26 09:09", "0"
"Boy-Girl#M.1545762690.A.B88#00060", "cindy95", "拜託不要復合像你這種不在乎伴侶心情的男友你就不應該交女朋友不要講得很像自己錢出比較多很偉大一樣", "12/26 09:10", "1"
"Boy-Girl#M.1545762690.A.B88#00061", "yukina23", "活該啊，接送不拒絕還在那邊裝無辜裝委曲，啊不就好可憐", "12/26 09:11", "1"
"Boy-Girl#M.1545762690.A.B88#00062", "j1255ccc", "你怕他整形成你不喜歡的樣子噢", "12/26 09:14", "0"
"Boy-Girl#M.1545762690.A.B88#00063", "yukina23", "光接送不拒絕還嗆聲，就覺得分了剛好而已啦", "12/26 09:18", "0"
"Boy-Girl#M.1545762690.A.B88#00064", "j4ijp", "分了好，老實說她沒那麼愛你，你的努力你的挽回她看不見", "12/26 09:21", "0"
"Boy-Girl#M.1545762690.A.B88#00065", "dynastyfo", "跟別的女生抱怨自己的女朋友是什麼心態", "12/26 09:25", "0"
"Boy-Girl#M.1545762690.A.B88#00066", "blueskyen", "先反省自己（認真說）一定是有很奇怪的地方不然你女朋友不會這樣發作。我也很受不了前男友明明人在旁邊卻一直在跟其他女生報備行程什麼的，聊天24小時都沒斷過。感覺超級差的", "12/26 09:31", "1"
"Boy-Girl#M.1545762690.A.B88#00067", "LuciusMalfoy", "所以到底有沒有聊一整路 不過你現在也可以盡情聊啦", "12/26 09:37", "1"
"Boy-Girl#M.1545762690.A.B88#00068", "suiminkusuri", "整形是不是整陰唇啊哈哈哈哈", "12/26 09:37", "0"
"Boy-Girl#M.1545762690.A.B88#00069", "ayabf", "跟女同事關係還沒進展到下一步就被分了，哭", "12/26 09:41", "0"
"Boy-Girl#M.1545762690.A.B88#00070", "jean253714", "刪訊息就有鬼啊 不用演囉", "12/26 09:44", "0"
"Boy-Girl#M.1545762690.A.B88#00071", "star4cat", "去找女同事啦", "12/26 09:52", "0"
"Boy-Girl#M.1545762690.A.B88#00072", "a13045423", "還在裝", "12/26 10:08", "0"
"Boy-Girl#M.1545762690.A.B88#00073", "lin03lin11", "虧虧虧。。。就是愛虧，保持距離很難嗎？就沒有同事，朋友來問我傷口，他們都直接找醫師啦！", "12/26 10:09", "0"
"Boy-Girl#M.1545762690.A.B88#00074", "sugardai", "你終於能好好關心女同事了", "12/26 10:11", "0"
"Boy-Girl#M.1545762690.A.B88#00075", "lin03lin11", "女友在意的事你一直犯，理由再正當又怎樣？ 去找一個可以接受你虧女同事的女友吧", "12/26 10:11", "1"
"Boy-Girl#M.1545762690.A.B88#00076", "raebailey", "你有沒有尊重女友啊", "12/26 10:13", "0"
"Boy-Girl#M.1545762690.A.B88#00077", "NENEHOW", "以後可以一直跟女同事聊不用刪訊息囉", "12/26 10:15", "0"
"Boy-Girl#M.1545762690.A.B88#00078", "Joker3", "這說法我真的不行 XDDDDDDDDD", "12/26 10:18", "0"
"Boy-Girl#M.1545762690.A.B88#00079", "vi000246", "好想備份但是我懶 樓下幫忙", "12/26 10:21", "0"
"Boy-Girl#M.1545762690.A.B88#00080", "ovuvo", "我也會刪訊息耶，但是訊息一定有些曖昧或是嘴砲虧女生才會刪 你說對不對", "12/26 10:22", "1"
"Boy-Girl#M.1545762690.A.B88#00081", "betear", "先卡個位", "12/26 10:22", "0"
"Boy-Girl#M.1545762690.A.B88#00082", "q076262018", "摁", "12/26 10:22", "0"
"Boy-Girl#M.1545762690.A.B88#00083", "syrup", "都這樣你還可以義正嚴辭的幫自己找一堆藉口 可憐", "12/26 10:28", "0"
"Boy-Girl#M.1545762690.A.B88#00084", "bettylin9", "那個刪掉通常只會變成羅生門而已XD 你遇到這種事的反，應很奇怪，對方就是出於不信任所以要看，沒事的話就給看到，有誤會就澄清，其實我有些朋友甚至是家人是這樣所以才關係好的（當然是需要時間），我弟以前會自己把我的手機拿起來看，我有嚇到覺得很不被尊重，但他發現裡面什麼有趣的都沒有就沒再看了，因為他自己的手機比我的好XD 當然對方三不五時就靠腰你，你問對方為什麼要這樣，她如果說得出你最近的行為如何如何，那就是可以討論的，不是絕對不看或是狂看，不同情況當然不同行為反應，但刪掉那不就表示你和女友認知的落差沒有東西可以討論了嗎？因為只有單方面知道這件事的全貌，都給你說就好啦，你真的有想顧慮過對方的感受和想法嗎？你或許什麼對不起她的事都沒做過，但你也沒有在乎她就是了，這樣跟陌生人有什麼兩樣？何必在感情上說要在一起？", "12/26 10:41", "0"
"Boy-Girl#M.1545762690.A.B88#00085", "kkessherry", "說不刪會衍生問題 每個刪了發生更大問題的都不知道在男女板看過幾篇了", "12/26 10:42", "1"
"Boy-Girl#M.1545762690.A.B88#00086", "bettylin9", "當你把門關起來的時候，別人只會覺得原來你想靜一靜，沒有想要跟我一起的意思，那只好摸摸鼻子走人啦，不然留在你門口像個白痴還花痴？", "12/26 10:44", "1"
"Boy-Girl#M.1545762690.A.B88#00087", "bettylin9", "長大了想交女友，就麻煩多瞭解別人理解別人一點，不要只是要別人了解你理解你而已", "12/26 10:46", "1"
"Boy-Girl#M.1545762690.A.B88#00088", "LuciusMalfoy", "看了補充 完全就是個大剌剌", "12/26 10:50", "0"
"Boy-Girl#M.1545762690.A.B88#00089", "bettylin9", "你一直說你自己多對多合理，對方多誇張多78，覺得跟我昨天晚上看電視看到，地方政府說中央政府做得多不好該配合他有87像，中央政府難道沒有他對全台該有統整規劃的職責？不是針對藍綠，因為中央政府是藍色的政治環境也出現過了，他們只是角色對換，但做一樣的事，一直說自己多合理對方多誇張，看新聞只是在看他們說說說，做的呢？你們都換到你們曾經想要的位子了，那都把當初指責別人做不好的地方做好了嗎？為什麼要把時間拿來跟人民說對方多無理？人民只是想知道你們到底把事情做到什麼程度了？有沒有共同合作或分權也可以，總之我不會覺得我繳稅就是要來聽這些的。意思就是你在這裡說你多合理多沒做錯要幹麻？除了出一口氣以外，維護你在ptt上的名聲？通常辯護自己不會得到好名聲，群眾只會覺得關我P事", "12/26 10:56", "1"
"Boy-Girl#M.1545762690.A.B88#00090", "Ching0627", "刪了只會造成更大的問題", "12/26 10:57", "0"
"Boy-Girl#M.1545762690.A.B88#00091", "abby9160", "好啦反正於事無補，你就繼續用這些理由說服自己沒有問題吧，下一任記得找個可以接受你 載女同事、跟女同事互傳照片、煩惱商談、私聊抱怨女友 的女友唷", "12/26 11:01", "1"
"Boy-Girl#M.1545762690.A.B88#00092", "abby9160", "重點根本不是別的同事有沒有跟那位女同事也這樣，而是你這個有女友的人不能這樣，懂？", "12/26 11:03", "1"
"Boy-Girl#M.1545762690.A.B88#00093", "mic303", "你就換個想法，出國的時候女友不care你反而一直跟同一個，異性喇賽，看你爽不爽", "12/26 11:10", "0"
"Boy-Girl#M.1545762690.A.B88#00094", "mic303", "就問你憑什麼你女友需要包容出國的時候你跟別人聊天，那她也可以啊", "12/26 11:12", "1"
"Boy-Girl#M.1545762690.A.B88#00095", "TWvincent", "連續劇打廣告？", "12/26 11:14", "0"
"Boy-Girl#M.1545762690.A.B88#00096", "qaz123342", "你是不是想", "12/26 11:17", "0"
"Boy-Girl#M.1545762690.A.B88#00097", "ty306", "各說各話欸 但為何風向靠女生 ㄏ", "12/26 11:17", "0"
"Boy-Girl#M.1545762690.A.B88#00098", "beverly4222", "你不是覺得沒什麼嗎", "12/26 11:20", "0"
"Boy-Girl#M.1545762690.A.B88#00099", "GirlWhoCode", "所以如果你女友沒提醒你 你就會繼續聊喔 你能接受你女友出國一直跟異性聊嗎？", "12/26 11:30", "1"
"Boy-Girl#M.1545762690.A.B88#00100", "yukina23", "她就很不爽了，你還要在她面前買伴手禮給那個女同事?", "12/26 11:38", "0"
"Boy-Girl#M.1545762690.A.B88#00101", "MurMur", "其實你訊息刪掉 稱聊天內容沒什麼也沒人信", "12/26 11:41", "0"
"Boy-Girl#M.1545762690.A.B88#00102", "cmimfd", "你是不是雙重標準？你說你重隱私，難道兩個人的感情問題就不算隱私嗎？有摩擦就兩個人溝通解決，不懂跟不相關的人抱怨是為什麼。另外，你解釋的內容只讓我覺得你不懂得尊重你的另一半。", "12/26 11:42", "1"
"Boy-Girl#M.1545762690.A.B88#00103", "bio2133", "如果是日後會影響兩人關係的內容，你當初根本不該和別人聊，最後還做賊心虛", "12/26 11:51", "1"
"Boy-Girl#M.1545762690.A.B88#00104", "m0630821", "噁心", "12/26 11:56", "0"
"Boy-Girl#M.1545762690.A.B88#00105", "Reneeeating", "嗯 你好有理 拍手", "12/26 12:13", "0"
"Boy-Girl#M.1545762690.A.B88#00106", "yayalululu", "怕她看到訊息掃興? 呵呵你的各種行為才是真掃興好嗎", "12/26 12:35", "0"
"Boy-Girl#M.1545762690.A.B88#00107", "Ajisai", "看來你還是認為「我的行為真的都沒什麼啊= =」，那你最多回一下覺得她整得對不對稱 還傳什麼幾張照片 寒喧", "12/26 12:37", "0"
"Boy-Girl#M.1545762690.A.B88#00108", "Ajisai", "還不只一張 好幾張咧 感情真的很好 呵呵，女同事是你什麼人？你有先跟你家人傳幾張照片寒喧嗎？", "12/26 12:39", "0"
"Boy-Girl#M.1545762690.A.B88#00109", "oouso", "推下下篇回文。先不提片面之詞真相難解，就算退一百步真的都沒有越線，你硬要連續踩線這麼多次，就是要當朋友就是要多講兩句貼貼照片碎念感情隱私調笑一下然後再喊手機隱私不可退讓完全不理女友多次溝通我看你也是拗的可以，雙標人好煩，你要踩這麼多原則，她無法接受分手超剛好啊。", "12/26 12:51", "1"
"Boy-Girl#M.1545762690.A.B88#00110", "GRIPIT", "恭喜前女友", "12/26 13:06", "0"
"Boy-Girl#M.1545762690.A.B88#00111", "Phoebe0503", "所以幹嘛刪訊息？以前可以看，現在一樣不給看？不是，有鬼是什麼？", "12/26 13:39", "0"
"Boy-Girl#M.1545762690.A.B88#00112", "bettyshinn", "你就盡情地聊天 可以嗎? 愛刪就是有鬼!!!!!!!!!!!爛", "12/26 13:45", "0"
"Boy-Girl#M.1545762690.A.B88#00113", "cake61", "so suck", "12/26 14:12", "0"
"Boy-Girl#M.1545762690.A.B88#00114", "sprsheep", "刪訊息和出國玩還聊我也不行 恭喜你現在更不用避嫌了 想怎樣都可以！", "12/26 14:35", "1"
"Boy-Girl#M.1545762690.A.B88#00115", "dl3478", "擺明有鬼，講再多都沒用。換個角度想，今天你女友這樣對妳，跟你講一樣的理由，我不信你他媽的全盤接受。", "12/26 14:57", "0"
"Boy-Girl#M.1545762690.A.B88#00116", "Ujdhw3425", "醒醒 你沒有女朋友", "12/26 15:15", "0"
"Boy-Girl#M.1545762690.A.B88#00117", "kelvin1105", "是前任了呦 渣男^_^", "12/26 15:29", "0"
"Boy-Girl#M.1545762690.A.B88#00118", "besthorse", "辛苦妳了啦 如果真沒做壞事 就當做教訓", "12/26 15:36", "0"
"Boy-Girl#M.1545762690.A.B88#00119", "wesley933", "恭喜你逃過一劫 以後別再養公主了qq", "12/26 16:06", "0"
"Boy-Girl#M.1545762690.A.B88#00120", "BIBIOO", "是在靠腰三小？", "12/26 16:35", "0"
"Boy-Girl#M.1545762690.A.B88#00121", "azure1428", "恭喜你不用再忍受女友的拗脾氣了 以後想跟誰聊天就跟誰聊天 不會擔心被看手機還要刪聊天紀錄 想跟哪一個前任聯絡也不會被干涉了 世界變的很美好啊 真心恭喜~", "12/26 16:38", "1"
