"Serial_Number", "User_ID", "Main_Content", "Time", "Max_Word_Indicator"
"C_Chat#M.1548577058.A.AB9#00000", "Zuminox", "大家好 我這邊是在八卦版發文的原PO<br><br>這文除了跟跟凱文道歉跟證明他的清白以外<br><br>順便爆掛跟八卦一下 希望大家廣為擴散<br><br>歡迎轉貼跟分享各大平台 希望能夠把資訊完整傳達<br><br>倘若只想要寫部分內容 也請將整個段落完整複製 不要學妓者斷章取義<br><br>大家有甚麼想問的盡管提出 在我能回答的範圍內我會盡可能回答<br><br>-<br><br>所以特別發這篇文幫凱文洗白<br><br>由於因為誤把 13門中道那個團誤認為是凱文團<br><br>經過查證以及 13門中道的團提供當時夜排寫的列隊順序表<br><br>凱文團並沒有在上面 凱文本人只是被找去幫忙排隊跟聊天的<br><br>1/26當天他並沒有在13門排隊<br><br>這部分查證後發現是真的搞錯了...<br><br>嚴重造成凱文本人在工作上的困難<br><br>以及身邊朋友對他的質疑我真的感到抱歉<br><br>-<br><br>當然 我相信只是道歉文我相信根本沒人想看<br><br>所以我決定來多爆幾個掛<br><br>順便回覆一下前幾篇文章想討論的東西<br><br>以及有些留言中有人提出的疑問<br><br>-<br><br>我這邊先自爆 雖然我本人在原文中<br><br>把自己的身分寫的就像是廠商參展的廠商一樣<br>(至少我給自己的設定是這樣)<br><br>其實我本人是 排在17門的第一團的團長<br><br>本身夜排也是行之有年 但要不是偶像來還真的很懶得排<br><br>在13門發生的狀況我全程參與<br><br>不然不可能寫得那麼鉅細靡遺<br><br>甚至忘了發懶人包 在這邊跟大家道歉<br><br>這篇文要爆的主要是幾個重點<br><br>    1. 李O天集團到底是誰 有沒有照片 他們運作方式?<br><br>    2. 轉賣好賺嗎? 通常會以甚麼東西下手 對象通常是誰<br><br>    3. 夜排的情況有沒有辦法遏止? 有沒有改良方案?<br><br>    4. 本次主辦單位的事前預防措施以及我個人的一些見解<br><br>    5. 孫安佐昨天有沒有出現 (至少八卦版有人問<br><br>    6. 目前已知 Y君 後續採取的法律行動<br><br>    7. 南港夜排趣事(有空再補)<br><br>    8. 以上總結<br><br>    9. 有需要會再補充<br><br><br>老樣子 文長慎入<br><br><br><br><br>1. 李O天集團到底是誰 有沒有照片 他們的運作方式<br><br>好的 反正我還是碼一下<br><br>不過前幾篇文已經有人做出解碼選項了<br><br>想要他們首腦照片的話直接估狗圖片會有<br><br>插隊的那個就是<br><br>他們的運作方式跟電影演的販毒商有點像<br><br>他們很少自己出面處理事情<br><br>除非是簽名這種會跑票或是跟其他團談判要點聲望的<br><br>他們才會自己出來 不然都叫小弟去辦事<br><br>排隊都叫小弟或是找人排隊<br><br>自己爽爽回家睡到飽 幹部群早上再來解壓縮<br><br>甚至叫小弟去當魁儡團長 出事都是他的錯 自己沒問題<br><br><br><br>南港也有他們的事情 後面可以看看<br><br><br><br>2. 轉賣廚好賺嗎? 通常會以甚麼東西下手 對象是誰<br><br>以這次PS攤位上面發生的事情來說<br><br>他們可以不用任何商品成本 就可以開始獲利了<br><br>上篇文章說他賣3000那個還算是客氣的呢<br><br>我目前已經打聽到有人跟他們5000收昨天那張簽名板<br><br>但我想這東西還會再往上漲 沒毛病<br><br><br>撇開這次PS<br><br>這群轉賣廚還會專挑BL、高人氣作品、無本萬利的限量商品去搶<br><br>特別針對BL向的作品去搶購<br><br>因為他們覺得宅女的消費力比起宅男更加強大<br><br>而且宅女買到之後<br><br>還會感謝這群轉賣廚讓他有機會可以用錢就機會見到偶像<br><br>甚至形成忠實顧客 還幫他口碑行銷<br><br>不要說不可能 或是說這想法太扯了<br><br>只要想你有的是錢<br><br>只要你有一個很喜歡的偶像<br><br>只要你能負擔比原價多上個一倍以上的價錢<br><br>你就可以近距離見到偶像本人<br><br>甚至跟他握手 跟他合照 拿他相關作品的簽名板<br><br>你還不用花時間排隊或是等機台<br><br>這買賣值不值? 值!!!<br><br>是我 我也想要 但我沒錢 ((燦笑<br><br>從這樣的角度來看他們會有這樣的行為<br><br>也就只是轉賣廚跟宅男宅女供需問題而已<br><br>準確地抓住消費者的心理<br><br>這也是轉賣廚跟黃牛的共通點<br><br>我告訴你 你一定想買 但你也抵制不了<br><br>只要還符合我上述黃字三個條件 就沒機會<br><br>能控制這狀況的也只有活動主辦單位能夠做到<br><br>這在後續再談<br><br><br>3. 夜排的情況有沒有辦法遏止? 有沒有改良方案?<br><br>好的 當然這是我的一些見解跟想法<br><br>這部分可以討論的範圍真的很大<br><br>大家可以在留言熱烈的討論<br><br>除了現場搶 目前常見的有：<br><br>        (1) 現場抽獎<br>        (2) 網路抽獎<br>        (3) 機台搶<br>        (4) 網路搶<br>        (5) 待補充<br><br>(1)現場抽獎<br><br>簡單的說<br><br>現場抽獎是我覺得目前可能比較公平的一個行為<br><br>但總會出現特例<br><br>詳細請看 2015年 FATE川澄綾子禮物盒抽簽名<br><br>17人團在颱風天連排3天<br><br>看起來除了工作證以及一個搶到的鄉民以外<br><br>他們應該是把簽名全部包下了<br><br>一方面這個抽獎的機率太高了<br><br>理論值是一個禮物盒至少30%的機率<br><br>當然 這是排列組合中 取後不放回的狀況<br><br>如果抽獎是取後放回呢?<br><br>我想 機率要是設在10%以下<br><br>大概結束之後還會有剩吧...<br><br>雖然這樣做真的可以賺得很飽<br><br>也能一定程度上遏止夜排行為<br><br><br>(2)網路抽獎<br><br>以東O出版社來說<br><br>從2015年以後大多採取這樣的方式去做資格選取<br><br>目前來說 爭議性很低 出版社也發展出實名制<br><br>是最確實遏止夜排的手法 但公平性有待考量<br><br>但洗人頭跟洗證件甚麼的 他們的機率肯定不比我們小<br><br>更不要說你那個駕照只是用一般護貝機<br><br>撕開換照片就好 官方還不是照看<br><br>洗這人頭根本不難<br><br>另外還有聽到風聲說 疑似出版社黑箱作業???<br><br>這我可以說明一下 但哪個出版社不明說<br><br>當然 我之前有跟某出版社打過交道<br><br>知道他們自己會保留份數 只是份數會壓<br><br>這部分也有跟日方做過溝通跟協調 這是允許的<br><br>不然我相信他們要是真的被發現<br><br>以後這出版社簽名會不用辦就算了<br><br>想代理作品都會有難度<br><br><br>(3)機台搶<br><br>這玩意兒除了擾民 讓需要用機台的人不能用以外<br><br>以目前來說 還非常好轉賣呢<br><br>但是人就必須站在機台來操作了<br><br>這也是唯一的優點<br><br><br>(4)網路搶<br><br>這我就不多說了<br><br>看看米津 你以為跟你搶票的都是人嗎???<br><br>醒醒吧 都是程式在跑 米津這次2秒就搶完了<br><br>還得考量網站是否能支撐等等的<br><br>雖然這是最一開始抵制夜排的方法<br><br>但隨著科技的演進<br><br>根本就變成了程式優化程度以及網路速度的競賽啊!!!<br><br>-<br><br>如果只是考量能否遏止夜排<br><br>上述的方法都能防止<br><br>但能不能防轉賣就不一定了<br><br>防轉賣的話 基本就是實名制 以及作品問題問答<br><br>實名制除非只用身分證 不然bug太多了<br><br>作品問題問答還得要考量粉絲到底能不能答出來<br><br>通常真粉都能答啦 轉賣廚就真的看情況了<br><br><br><br>4. 本次主辦單位的預防措施以及我個人的一些見解<br><br>直接說啦 雖然已經有人提醒過主辦單位<br><br>但時間上有點晚 人家工作證全部發出去了<br><br>而且 我相信電玩展主辦<br><br>大概是第一次碰到這麼棘手的問題<br><br>官方主要都把人都當成君子看<br><br>但防的了君子 防不了小人<br><br>把廠商參展證或是採訪證<br><br>從5 6 9 10 14出口的吸菸區往外送<br><br>或是直接放在背包夾帶出去再解壓縮進場<br><br>這些是可以用一次性的手環<br><br>或是當日限定且一次性的東西來代替<br><br>當然偽造參展證及採訪證這問題很嚴重<br><br>比起上述的鑽漏洞是直接面臨法律問題<br><br>更別說這次的證上沒有專屬編號<br><br>即使現場抓到也沒辦法溯源<br><br><br>當然這次我覺得部分官方工作人員也有疏失<br><br>但顯然這比較是我們這些夜排仔才會有的問題<br><br>比較不影響大眾 但我還是稍微提一下<br><br>這次放門的時間基本上都晚了<br><br>除了我17門這邊我跟他們打好關係請他們準時開門<br><br>不然我還聽說4門那邊的哀嚎說<br><br>他們的門前工作人員沒有無線電就算了<br><br>幾個人還聊得很開心<br><br>開場還是他們提醒開場才放入的<br><br>13門中道貌似除了晚放 還被運貨的廠商給擋住<br><br>導致他們搶的不如預期很多<br><br><br>5. 孫安佐昨天有沒有出現<br><br>先說 我覺得孫安佐很無辜<br><br>但我還是想把他提出來((和善的微笑<br><br>當時打架打完 PS的攤位人員把李O天集團的首腦<br><br>押到官方服務台的這段期間<br><br>我跟其他人從15門往外繞<br><br>就看見一個既熟悉又陌生的面孔<br><br>穿著那件阿嘿顏的衣服 瀟灑的在從PS攤位旁<br><br>從15門出去後左轉<br><br>對 沒有然後 這就只是八卦而已 沒甚麼<br><br><br><br>6. 目前 Y君採取之法律行動<br><br>目前已知簽名板以及財務毀損<br><br>但由於沒有外傷可以佐證他是真的受到攻擊<br><br>所以目前已經請PS幫我們看一下有沒有當時的現場錄影<br><br>要是各位有相關的資料<br><br>還請麻煩站內信跟我聯絡一下<br><br>我這陣子會勤一點上線看的...<br><br><br>說一下總結<br><br>我希望大家用力分享這個文章<br><br>一方面 我讓凱文受到傷害了<br><br>雖然他過去做的事情不對<br><br>但今天他很無辜 我希望可以還他一個公道<br><br>畢竟今天跟他沒關係<br><br>所以我今天起床後知道訊息馬上又撰了這篇文<br><br>希望大家可以幫忙轉發<br><br>更希望讓這件事情用力燒起來<br><br>讓主辦看到 讓主辦重視 讓主辦有改進的空間<br><br>不論是電腦公會也好 還是各個活動主辦的參展廠商也好<br><br>我希望的是以讓他們改進為優先<br><br>針對這件事情進行宣傳 而不是一昧的謾罵<br><br><br>以上 希望夜排文化從此消失的不知名夜排團團長敬上<br><br>--<br>", "", ""
"C_Chat#M.1548577058.A.AB9#00001", "Firstshadow", "(づ′・ω・）づ 10.所以你們有解壓縮嗎?", "01/27 16:20", "0"
"C_Chat#M.1548577058.A.AB9#00002", "seiya2000", "打架過程怎麼沒說明？打人的是誰？被打的是誰？", "01/27 16:21", "0"
"C_Chat#M.1548577058.A.AB9#00003", "a3118", "其實現場30張競標就好了 廠商能賺 還能有話題 轉賣廚也沒，錢ㄎㄎ", "01/27 16:22", "0"
"C_Chat#M.1548577058.A.AB9#00004", "ian5771016", "這文章我也是笑了。", "01/27 16:22", "0"
"C_Chat#M.1548577058.A.AB9#00005", "kumaliu", "對啊解壓縮呢？", "01/27 16:22", "0"
"C_Chat#M.1548577058.A.AB9#00006", "andy0481", "看半天沒看到哪裡洗白了 所以有沒有解壓縮?", "01/27 16:22", "0"
"C_Chat#M.1548577058.A.AB9#00007", "rockyao", "妳有沒有解壓縮 一句話", "01/27 16:24", "0"
"C_Chat#M.1548577058.A.AB9#00008", "p200404", "解壓縮有好到那邊去嗎 不也是插隊", "01/27 16:24", "0"
"C_Chat#M.1548577058.A.AB9#00009", "zxzxcv", "都臭到翻了還洗什麼白", "01/27 16:26", "0"
"C_Chat#M.1548577058.A.AB9#00010", "r02182828", "希望夜排文化從此消失的不知名夜排團團長  哈哈哈哈哈", "01/27 16:26", "1"
"C_Chat#M.1548577058.A.AB9#00011", "xsdferty035", "解壓縮 呵呵", "01/27 16:26", "0"
"C_Chat#M.1548577058.A.AB9#00012", "fugitive24", "所以夜排=解壓縮嗎？", "01/27 16:28", "0"
"C_Chat#M.1548577058.A.AB9#00013", "angelegg", "一開始就猜是圈內內鬨 不然哪會說那摸細 果然4這樣", "01/27 16:28", "0"
"C_Chat#M.1548577058.A.AB9#00014", "xGx", "插隊就插隊，解壓縮?", "01/27 16:28", "0"
"C_Chat#M.1548577058.A.AB9#00015", "rockyao", "我覺得怎麼沒去找個場地大亂鬥 哪團能活下來 全拿 嘻嘻", "01/27 16:29", "0"
"C_Chat#M.1548577058.A.AB9#00016", "SaberTheBest", "什麼時候大亂鬥?", "01/27 16:29", "0"
"C_Chat#M.1548577058.A.AB9#00017", "WindSpread", "什麼叫給你自己的設定", "01/27 16:31", "0"
"C_Chat#M.1548577058.A.AB9#00018", "yc002154", "我笑了，婊子還要立牌坊", "01/27 16:31", "0"
"C_Chat#M.1548577058.A.AB9#00019", "LoveMakeLove", "辛苦了", "01/27 16:31", "0"
"C_Chat#M.1548577058.A.AB9#00020", "rockyao", "所以你冒充廠商? 妳這樣警察不用抓喔XDDD", "01/27 16:31", "0"
"C_Chat#M.1548577058.A.AB9#00021", "Q12345Q", "很明顯是同行互打啊", "01/27 16:31", "0"
"C_Chat#M.1548577058.A.AB9#00022", "gy24cfj5", "肥宅什麼時候要大亂鬥一下啊 贏的全拿阿", "01/27 16:32", "0"
"C_Chat#M.1548577058.A.AB9#00023", "Q12345Q", "怎麼可能會認為你是廠商 好幾個ID真的把這當幼兒園", "01/27 16:33", "0"
"C_Chat#M.1548577058.A.AB9#00024", "Q12345Q", "帶風向 互咬 隨便 但怎把自己當正義的解壓縮廚", "01/27 16:35", "0"
"C_Chat#M.1548577058.A.AB9#00025", "Justapig", "原來是插隊垃圾噢", "01/27 16:35", "0"
"C_Chat#M.1548577058.A.AB9#00026", "Firstshadow", "(づ′・ω・）づ 哦 所以你也解過, 同行別互咬八", "01/27 16:36", "0"
"C_Chat#M.1548577058.A.AB9#00027", "ga652206", "現在解壓縮互鬥互相大和解 呵呵呵呵呵，本是同根生 相姦何太急", "01/27 16:37", "0"
"C_Chat#M.1548577058.A.AB9#00028", "haha98", "解壓仔還想裝清高 呵", "01/27 16:39", "0"
"C_Chat#M.1548577058.A.AB9#00029", "badend8769", "這次沒有罷了", "01/27 16:40", "0"
"C_Chat#M.1548577058.A.AB9#00030", "rockyao", "真辛苦", "01/27 16:41", "0"
"C_Chat#M.1548577058.A.AB9#00031", "tokugawa", "有卦給推", "01/27 16:41", "0"
"C_Chat#M.1548577058.A.AB9#00032", "TWKaner", "原來是同行阿", "01/27 16:41", "0"
"C_Chat#M.1548577058.A.AB9#00033", "lanjack", "要遏止這些很簡單啊，找比你們更大尾的黑道出來橋就好。命自己的嘛XD", "01/27 16:45", "1"
"C_Chat#M.1548577058.A.AB9#00034", "gy24cfj5", "肥宅哪裡會找黑道 肥宅都欺負更弱的肥宅而已  沒事兒", "01/27 16:46", "0"
"C_Chat#M.1548577058.A.AB9#00035", "Ikaruwill", "不擇手段好意思講得那麼理所當然", "01/27 16:46", "0"
"C_Chat#M.1548577058.A.AB9#00036", "Chantaljones", "肥宅不是最怕不怕你兇跟盧的嗎XD", "01/27 16:47", "0"
"C_Chat#M.1548577058.A.AB9#00037", "tlasidoen", "小混混吧  黑道怎麼想喬這種", "01/27 16:47", "0"
"C_Chat#M.1548577058.A.AB9#00038", "lanjack", "沒什麼，肥宅都會玩噴火槍屯噴子了，黑道體系的宅宅也不是稀有的事情", "01/27 16:47", "1"
"C_Chat#M.1548577058.A.AB9#00039", "Q12345Q", "這系列文有其他ID 也是參與其中的 沒看出嗎", "01/27 16:47", "0"
"C_Chat#M.1548577058.A.AB9#00040", "tim0619123", "lul台灣宅宅圈真的只剩下這種人ㄌㄇ 真的可悲= =", "01/27 16:47", "0"
"C_Chat#M.1548577058.A.AB9#00041", "class21535", "解壓縮就是插隊 還定義個屁勒 亂爆料更是無恥", "01/27 16:47", "0"
"C_Chat#M.1548577058.A.AB9#00042", "p200404", "定義勒 插隊就是該死", "01/27 16:47", "0"
"C_Chat#M.1548577058.A.AB9#00043", "b325019", "狗咬狗", "01/27 16:47", "0"
"C_Chat#M.1548577058.A.AB9#00044", "fugitive24", "一次解一個跟解20個差在哪？ 還有臉發文酸人", "01/27 16:48", "0"
"C_Chat#M.1548577058.A.AB9#00045", "ga652206", "和ikea很多唸法一樣 只是我們唸解壓縮 你們是夜排", "01/27 16:48", "0"
"C_Chat#M.1548577058.A.AB9#00046", "relyt", "狗大路過", "01/27 16:49", "0"
"C_Chat#M.1548577058.A.AB9#00047", "Ericz7000", "五十步笑百步 小學畢業了嗎", "01/27 16:49", "0"
"C_Chat#M.1548577058.A.AB9#00048", "qsgjnmvb", "提油救火。噁心", "01/27 16:49", "0"
"C_Chat#M.1548577058.A.AB9#00049", "Chantaljones", "我現在還有個問題 我之前排3人團 1個去廁所 買飯，這到底較不叫解壓縮阿= =我一直認為我們這樣算= =雖然我只排過這麼一次 但我還是很困惑=_=前面有人說是 也有人說不是QQ", "01/27 16:49", "0"
"C_Chat#M.1548577058.A.AB9#00050", "tim0619123", "樓上 那個不算解壓縮喔! 算是插隊lul", "01/27 16:50", "0"
"C_Chat#M.1548577058.A.AB9#00051", "ga652206", "排隊上廁所嗎", "01/27 16:51", "0"
"C_Chat#M.1548577058.A.AB9#00052", "lanjack", "我幹嘛身體力行XDD，出錢找人處理就好了，還追不到我身上。傻子才會嘴的人自己處理wwe館長XD，他是生意人啦", "01/27 16:51", "1"
"C_Chat#M.1548577058.A.AB9#00053", "jkkkj123", "所以有不擇手段ㄛ… 這樣還這麼理直氣壯的希望主辦方改善還真是正直R", "01/27 16:51", "1"
"C_Chat#M.1548577058.A.AB9#00054", "gaym19", "所以還是解壓仔大戰轉賣廚啊 洗什麼白", "01/27 16:51", "0"
"C_Chat#M.1548577058.A.AB9#00055", "fugitive24", "你能不擇手段拿東西 別人就不能不擇手段賺錢嗎", "01/27 16:51", "0"
"C_Chat#M.1548577058.A.AB9#00056", "gekisen", "你們的人 啊所以你們也是解壓縮大隊麻 淦是差在哪", "01/27 16:51", "0"
"C_Chat#M.1548577058.A.AB9#00057", "a760981", "黑道很大尾？ 是要叫館長找你泡茶聊一下？不然整天黑道掛在嘴邊嗆人 到時館長來一下會不會變小孬孬了", "01/27 16:52", "0"
"C_Chat#M.1548577058.A.AB9#00058", "garethleo54", "哪天解壓縮時被人打的滿地找牙就乖乖吞下去", "01/27 16:52", "0"
"C_Chat#M.1548577058.A.AB9#00059", "Chantaljones", "也不是排隊上廁所 就要上廁所的去順便買飯=_=", "01/27 16:52", "0"
"C_Chat#M.1548577058.A.AB9#00060", "DreamsInWind", "解壓縮當然不等於夜排  我一個人去排一整夜  就不會跟別人解壓縮啊  反過來講  我也早上才到找認識的人解壓縮插隊  這是很簡單的邏輯吧", "01/27 16:52", "1"
"C_Chat#M.1548577058.A.AB9#00061", "tim0619123", "台灣黑道被搞得好像很可笑= =", "01/27 16:52", "0"
"C_Chat#M.1548577058.A.AB9#00062", "fugitive24", "解壓縮仔還敢發文酸人 笑死", "01/27 16:53", "0"
"C_Chat#M.1548577058.A.AB9#00063", "seer2525", "基本上是真的暫離買東西大家不會覺得怎麼樣，解壓縮是晚上都沒出現 早上直接插進來基本上只要你來排之後幾乎都在 買東西上廁所沒什麼問題", "01/27 16:53", "0"
"C_Chat#M.1548577058.A.AB9#00064", "lanjack", "黑道不會可笑啊，他們也是拿錢辦事的。圍個事而已，沒啥", "01/27 16:54", "1"
"C_Chat#M.1548577058.A.AB9#00065", "garethleo54", "說實話在場排隊的都看得出來哪些人一開始就在，哪些人是快開門才突然冒出來", "01/27 16:54", "0"
"C_Chat#M.1548577058.A.AB9#00066", "jkkkj123", "再噓一下 原PO把不擇手段修掉了", "01/27 16:56", "0"
"C_Chat#M.1548577058.A.AB9#00067", "DreamsInWind", "還有我真看不出來昨天那篇文章會對凱文造成什麼工作上的困擾  凱文也不會是真名吧  鬼才知道他工作是啥", "01/27 16:56", "1"
"C_Chat#M.1548577058.A.AB9#00068", "ga652206", "這幾篇知道內情的也8成都同行", "01/27 16:56", "0"
"C_Chat#M.1548577058.A.AB9#00069", "fugitive24", "自己就是搞臭名聲的人 還發文想找更好的方法，真的很好笑 你們都別解壓縮跟轉賣不就好了", "01/27 16:56", "0"
"C_Chat#M.1548577058.A.AB9#00070", "seer2525", "另外原來你也是同行 輪班制在乖乖夜排的人眼裡跟解壓縮沒兩樣", "01/27 16:57", "1"
"C_Chat#M.1548577058.A.AB9#00071", "nihilistrue", "囂張不會有落魄的久，走著瞧吧。", "01/27 16:57", "0"
"C_Chat#M.1548577058.A.AB9#00072", "qaz223gy", "解壓縮當然是當天早上快開始前才解壓縮啊  誰不知道?不要玩文字遊戲了", "01/27 16:57", "0"
"C_Chat#M.1548577058.A.AB9#00073", "TWKaner", "都一樣的人不要分那麼細", "01/27 16:57", "0"
"C_Chat#M.1548577058.A.AB9#00074", "fugitive24", "當然不一樣啊 我們輪班制人數比較少哦啾咪", "01/27 16:59", "0"
"C_Chat#M.1548577058.A.AB9#00075", "DreamsInWind", "Y君有告到底我就推回來啦  我猜不是吞下去就是拿錢和解掉了", "01/27 16:59", "1"
"C_Chat#M.1548577058.A.AB9#00076", "Golu", "有差ㄇ", "01/27 16:59", "0"
"C_Chat#M.1548577058.A.AB9#00077", "jason1515", "解壓縮仔還敢說話阿 真正不解壓縮是你人到了才真正開始正是排隊", "01/27 17:00", "1"
"C_Chat#M.1548577058.A.AB9#00078", "DreamsInWind", "也不要牽拖沒有外傷啦要等錄影啦  現場工作人員是不是都還在?  警察找不到人證問嗎?  想吞下去就說啦XD", "01/27 17:01", "1"
"C_Chat#M.1548577058.A.AB9#00079", "TWKaner", "看了你上一篇文再噓", "01/27 17:01", "0"
"C_Chat#M.1548577058.A.AB9#00080", "tlasidoen", "有沒有年薪百萬  還是賺到一棟房子", "01/27 17:02", "0"
"C_Chat#M.1548577058.A.AB9#00081", "p200404", "結果還不是兩種人在內鬥 心態還跟自己講的李一樣 聽膩了勒 根本半斤八兩", "01/27 17:05", "1"
"C_Chat#M.1548577058.A.AB9#00082", "torahiko", "有沒有解壓縮還要別人解釋喔 有沒有人早上才到直接插隊啦？", "01/27 17:06", "1"
"C_Chat#M.1548577058.A.AB9#00083", "an94mod0", "謝謝你示範了傲慢和目中無人", "01/27 17:08", "0"
"C_Chat#M.1548577058.A.AB9#00084", "DreamsInWind", "真的要吉當下直接報警兩邊去做筆錄了  越想越不對勁才決定來吉一下喔  果然是很有愛呢", "01/27 17:08", "1"
"C_Chat#M.1548577058.A.AB9#00085", "lanjack", "#越想越不對勁", "01/27 17:10", "0"
"C_Chat#M.1548577058.A.AB9#00086", "erikzi", "真的愛就自己去夜排啊 侵犯到別人權利還能喊這麼大聲", "01/27 17:10", "0"
"C_Chat#M.1548577058.A.AB9#00087", "hsinhanchu", "end", "01/27 17:13", "0"
"C_Chat#M.1548577058.A.AB9#00088", "linzero", "○○犯歧視ＸＸ犯", "01/27 17:13", "0"
"C_Chat#M.1548577058.A.AB9#00089", "andy0481", "輪流排隊不就互插隊離開 然後最後全插隊回來而已..有本事輪流排隊後人數不要增加", "01/27 17:13", "0"
"C_Chat#M.1548577058.A.AB9#00090", "fugitive24", "就解壓縮團啊 有些是一個檔有些是好幾個檔但不同時間", "01/27 17:14", "1"
"C_Chat#M.1548577058.A.AB9#00091", "linzero", "嚴格的是完全不能離開隊伍。要通融的話是暫時離開幾分鐘上個廁所之類。而不是晚飯後來一下回去睡個覺早上再來", "01/27 17:15", "1"
"C_Chat#M.1548577058.A.AB9#00092", "puresugar", "狗咬狗一嘴毛", "01/27 17:15", "0"
"C_Chat#M.1548577058.A.AB9#00093", "fugitive24", "有沒有真的在排其他人都馬很清楚，就分割檔歧視單一檔 但都是解壓縮嘻嘻", "01/27 17:16", "0"
"C_Chat#M.1548577058.A.AB9#00094", "ng1life1", "ㄏㄏ", "01/27 17:16", "0"
"C_Chat#M.1548577058.A.AB9#00095", "linzero", "不過看來你們所謂業界的所謂共識是可以離開很久吧，排隊就是要搶名額，所以當某人來時前面有9個人，那他就是", "01/27 17:17", "0"
"C_Chat#M.1548577058.A.AB9#00096", "woody78963", "集團插隊就集團插隊,還要在那邊定義,你們就是水準低，不要說宅圈,有你們這種人什麼圈都能搞臭,不用想洗白", "01/27 17:17", "0"
"C_Chat#M.1548577058.A.AB9#00097", "s8510785107", "引火上身教學文", "01/27 17:18", "0"
"C_Chat#M.1548577058.A.AB9#00098", "marchcharlie", "半斤八兩", "01/27 17:18", "0"
"C_Chat#M.1548577058.A.AB9#00099", "linzero", "第10個名額順位。離開嚴格講就是自行取消資格。頂多找人幫忙佔或短時間離開一下。找人佔就是要全程有個人在位而所謂解壓縮就是排了一整晚，前面只有10個人，但突然早", "01/27 17:19", "1"
"C_Chat#M.1548577058.A.AB9#00100", "torahiko", "定義不就是最後有多人就是垃圾再插隊嗎", "01/27 17:21", "0"
"C_Chat#M.1548577058.A.AB9#00101", "francois106", "2沒壞", "01/27 17:21", "0"
"C_Chat#M.1548577058.A.AB9#00102", "linzero", "上變了很多才叫解壓縮，不然暫離一下幾分鐘上個廁所，有講好應該講好的人不認為是解壓縮。不然找人佔位", "01/27 17:21", "1"
"C_Chat#M.1548577058.A.AB9#00103", "skyslower", "我是覺得不用出來澄清了，都已經黑名聲黑成這樣了", "01/27 17:22", "0"
"C_Chat#M.1548577058.A.AB9#00104", "shlee", "一路看下來 只是轉賣團跟解壓縮團在互相噴對方 想把對方弄黑 顯得自己白一點  實際上兩邊半斤八兩把對方弄的黑一點也不會讓你們顯得比較白啊 旁人來看就是", "01/27 17:26", "1"
"C_Chat#M.1548577058.A.AB9#00105", "shlee", "在互鬥罷了", "01/27 17:28", "0"
"C_Chat#M.1548577058.A.AB9#00106", "valorhu", "離開一下(八小時)x", "01/27 17:28", "0"
"C_Chat#M.1548577058.A.AB9#00107", "Ewighket", "整個生態圈充滿惡臭", "01/27 17:28", "0"
"C_Chat#M.1548577058.A.AB9#00108", "seer2525", "Y君的那團也解壓啦 輪班制就解壓啊 巴哈那邊的當事人還說他們覺得輪班制不算解壓 一個人解十人才算髒咧", "01/27 17:29", "1"
"C_Chat#M.1548577058.A.AB9#00109", "linzero", "其實以後面人的權益來看輪班制也是可以，但是看同時間的人數。你輪班同時只有2個人，那就只有2個名額，而不是20個人輪", "01/27 17:31", "1"
